{
  "layout": {
    "fingers": [
      ""
    ]
  },
  "fingermap": [
    ""
  ],
  "board": {
    "isRowStaggered": true,
    "rowOrColumnStagger": [
      0,
      0,
      0
    ],
    "mirrorLeftRowStagger": false,
    "splitAngle": 0
  },
  "magic": {
    "rules": [],
    "magicKeys": null
  },
  "layers": null
}
