{
  "layout": {
    "fingers": [
      "f d l g v q b u o j",
      "s t h y w x n e a i",
      " k m * c z p r"
    ],
    "thumbs": [
      "space",
      ""
    ]
  },
  "fingermap": [
    "0 1 2 3 3 6 6 7 8 9",
    "0 1 2 3 3 6 6 7 8 9",
    " 1 2 3 3 3 6 6 7 8 9"
  ],
  "board": {
    "isRowStaggered": true,
    "mirrorLeftRowStagger": false,
    "splitAngle": 0,
    "rowOrColumnStagger": [
      0,
      0.25,
      0.75
    ]
  },
  "layers": null,
  "magic": {
    "magicKeys": null,
    "rules": [
      {
        "inputs": "a*",
        "output": "ao"
      },
      {
        "inputs": "u*",
        "output": "ue"
      },
      {
        "inputs": "r*",
        "output": "rn"
      },
      {
        "inputs": "p*",
        "output": "pr"
      },
      {
        "inputs": "b*",
        "output": "br"
      },
      {
        "inputs": "x*",
        "output": "xp"
      },
      {
        "inputs": "h*",
        "output": "hm"
      },
      {
        "inputs": "k*",
        "output": "ks"
      },
      {
        "inputs": "c*",
        "output": "cc"
      },
      {
        "inputs": "d*",
        "output": "dd"
      },
      {
        "inputs": "e*",
        "output": "ee"
      },
      {
        "inputs": "f*",
        "output": "ff"
      },
      {
        "inputs": "g*",
        "output": "gg"
      },
      {
        "inputs": "i*",
        "output": "ii"
      },
      {
        "inputs": "j*",
        "output": "jj"
      },
      {
        "inputs": "l*",
        "output": "ll"
      },
      {
        "inputs": "m*",
        "output": "mm"
      },
      {
        "inputs": "n*",
        "output": "nn"
      },
      {
        "inputs": "o*",
        "output": "oo"
      },
      {
        "inputs": "q*",
        "output": "qq"
      },
      {
        "inputs": "s*",
        "output": "ss"
      },
      {
        "inputs": "t*",
        "output": "tt"
      },
      {
        "inputs": "v*",
        "output": "vv"
      },
      {
        "inputs": "w*",
        "output": "ww"
      },
      {
        "inputs": "y*",
        "output": "yy"
      },
      {
        "inputs": "z*",
        "output": "zz"
      }
    ]
  }
}
