{
  "layout": {
    "fingers": [
      "f o u r z w v j l d",
      "y a i n c g s e h t",
      "' . , b x m p q k ;"
    ],
    "thumbs": [
      "",
      "space"
    ]
  },
  "fingermap": [
    "0 1 2 3 3 6 6 7 8 9",
    "0 1 2 3 3 6 6 7 8 9",
    "0 1 2 3 3 6 6 7 8 9"
  ],
  "board": {
    "isRowStaggered": true,
    "mirrorLeftRowStagger": false,
    "splitAngle": 0,
    "rowOrColumnStagger": [
      0,
      0.25,
      0.75
    ]
  },
  "layers": null,
  "magic": {
    "magicKeys": null,
    "rules": []
  }
}
