{
  "layout": {
    "fingers": [
      "f l h d m v w o u ,",
      "s r n t k g y a e i /",
      "x j b z q p c ' ; ."
    ],
    "thumbs": [
      "space",
      ""
    ]
  },
  "fingermap": [
    "0 1 2 3 3 6 6 7 8 9",
    "0 1 2 3 3 6 6 7 8 9 9",
    "0 1 2 3 3 6 6 7 8 9"
  ],
  "board": {
    "isRowStaggered": true,
    "mirrorLeftRowStagger": false,
    "splitAngle": 0,
    "rowOrColumnStagger": [
      0,
      0.25,
      0.75
    ]
  },
  "layers": null,
  "magic": {
    "magicKeys": null,
    "rules": []
  }
}
