{
  "layout": {
    "fingers": [
      "b l d f v , z o u ä",
      "n r t s m y h e i a",
      "ß j c g w k p ö ü ."
    ],
    "thumbs": [
      "space",
      ""
    ]
  },
  "fingermap": [
    "0 1 2 3 3 6 6 7 8 9",
    "0 1 2 3 3 6 6 7 8 9",
    "0 1 2 3 3 6 6 7 8 9"
  ],
  "board": {
    "isRowStaggered": true,
    "mirrorLeftRowStagger": false,
    "splitAngle": 0,
    "rowOrColumnStagger": [
      0,
      0,
      0
    ]
  },
  "layers": null,
  "magic": {
    "magicKeys": null,
    "rules": []
  }
}
