{
  "layout": {
    "fingers": [
      "f m p b w z j o u . ",
      " s t n d y x r a e i",
      "  k q c g v l h ' ; ,"
    ],
    "thumbs": [
      "space",
      ""
    ]
  },
  "fingermap": [
    "0 1 2 2 3 6 6 7 8 9",
    " 0 1 2 3 3 6 6 7 8 9 9",
    "  1 2 3 3 3 6 6 7 8 9"
  ],
  "board": {
    "isRowStaggered": true,
    "mirrorLeftRowStagger": false,
    "splitAngle": 0,
    "rowOrColumnStagger": [
      0,
      0.25,
      0.75
    ]
  },
  "layers": null,
  "magic": {
    "magicKeys": null,
    "rules": []
  }
}
