{
  "layout": {
    "fingers": [
      "b l m p w / u o y q  ",
      "n r t d f = e a i h ;",
      "z x v c g ' - , . k j"
    ],
    "thumbs": [
      "s",
      "space"
    ]
  },
  "fingermap": [
    "0 1 2 3 3 6 6 7 8 9",
    "0 1 2 3 3 6 6 7 8 9 9",
    "0 1 2 3 3 6 6 7 8 9 9"
  ],
  "board": {
    "isRowStaggered": true,
    "mirrorLeftRowStagger": false,
    "splitAngle": 0,
    "rowOrColumnStagger": [
      0,
      0,
      0
    ]
  },
  "layers": null,
  "magic": {
    "magicKeys": null,
    "rules": []
  }
}
