{
  "layout": {
    "fingers": [
      "k @ f y w q j u o .",
      " t m s d g x r i a h",
      "  z v p c b l n , ? '"
    ],
    "thumbs": [
      "space",
      "e"
    ]
  },
  "fingermap": [
    "0 1 2 2 3 6 6 7 8 9",
    " 0 1 2 3 3 6 6 7 8 9",
    "  0 1 3 3 3 6 6 7 8 9"
  ],
  "board": {
    "isRowStaggered": true,
    "rowOrColumnStagger": [
      0,
      0.25,
      0.75
    ]
  },
  "magic": {
    "rules": [
      {
        "inputs": "a@",
        "output": "aa"
      },
      {
        "inputs": "b@",
        "output": "bb"
      },
      {
        "inputs": "c@",
        "output": "cc"
      },
      {
        "inputs": "d@",
        "output": "dd"
      },
      {
        "inputs": "e@",
        "output": "ee"
      },
      {
        "inputs": "f@",
        "output": "ff"
      },
      {
        "inputs": "g@",
        "output": "gg"
      },
      {
        "inputs": "h@",
        "output": "hh"
      },
      {
        "inputs": "i@",
        "output": "ii"
      },
      {
        "inputs": "j@",
        "output": "jj"
      },
      {
        "inputs": "k@",
        "output": "kk"
      },
      {
        "inputs": "l@",
        "output": "ll"
      },
      {
        "inputs": "n@",
        "output": "nl"
      },
      {
        "inputs": "o@",
        "output": "oo"
      },
      {
        "inputs": "p@",
        "output": "pp"
      },
      {
        "inputs": "q@",
        "output": "qq"
      },
      {
        "inputs": "r@",
        "output": "rn"
      },
      {
        "inputs": "s@",
        "output": "ss"
      },
      {
        "inputs": "t@",
        "output": "tt"
      },
      {
        "inputs": "u@",
        "output": "u'"
      },
      {
        "inputs": "v@",
        "output": "vv"
      },
      {
        "inputs": "w@",
        "output": "ww"
      },
      {
        "inputs": "x@",
        "output": "xx"
      },
      {
        "inputs": "y@",
        "output": "ys"
      },
      {
        "inputs": "z@",
        "output": "zz"
      },
      {
        "inputs": ".@",
        "output": ".."
      },
      {
        "inputs": "?@",
        "output": "??"
      },
      {
        "inputs": "'@",
        "output": "''"
      }
    ]
  }
}
