{
  "layout": {
    "fingers": [
      "",
      "c r s t skip skip a e u i",
      "skip skip skip _ skip skip n"
    ]
  },
  "fingermap": [
    "",
    "0 1 2 3 0 0 6 7 8 9",
    "0 0 0 3 0 0 6"
  ],
  "board": {
    "isRowStaggered": true,
    "rowOrColumnStagger": [
      0,
      0.25,
      0.75
    ],
    "mirrorLeftRowStagger": false,
    "splitAngle": 0
  },
  "magic": {
    "rules": [],
    "magicKeys": null
  },
  "layers": null,
  "combos": [
    {
      "inputs": [
        "cr"
      ],
      "output": "w"
    },
    {
      "inputs": [
        "cs"
      ],
      "output": "f"
    },
    {
      "inputs": [
        "ct"
      ],
      "output": "g"
    },
    {
      "inputs": [
        "cn"
      ],
      "output": "q"
    },
    {
      "inputs": [
        "ca"
      ],
      "output": "'"
    },
    {
      "inputs": [
        "ce"
      ],
      "output": "#"
    },
    {
      "inputs": [
        "cu"
      ],
      "output": "y"
    },
    {
      "inputs": [
        "ci"
      ],
      "output": "p"
    },
    {
      "inputs": [
        "rs"
      ],
      "output": "x"
    },
    {
      "inputs": [
        "rt"
      ],
      "output": "j"
    },
    {
      "inputs": [
        "rn"
      ],
      "output": "l"
    },
    {
      "inputs": [
        "ra"
      ],
      "output": "!"
    },
    {
      "inputs": [
        "re"
      ],
      "output": "@"
    },
    {
      "inputs": [
        "ru"
      ],
      "output": "_"
    },
    {
      "inputs": [
        "ri"
      ],
      "output": ","
    },
    {
      "inputs": [
        "st"
      ],
      "output": "d"
    },
    {
      "inputs": [
        "sn"
      ],
      "output": "z"
    },
    {
      "inputs": [
        "sa"
      ],
      "output": "`"
    },
    {
      "inputs": [
        "su"
      ],
      "output": "v"
    },
    {
      "inputs": [
        "si"
      ],
      "output": "b"
    },
    {
      "inputs": [
        "tn"
      ],
      "output": "m"
    },
    {
      "inputs": [
        "tu"
      ],
      "output": "k"
    },
    {
      "inputs": [
        "ti"
      ],
      "output": "/"
    },
    {
      "inputs": [
        "na"
      ],
      "output": "("
    },
    {
      "inputs": [
        "ne"
      ],
      "output": ")"
    },
    {
      "inputs": [
        "nu"
      ],
      "output": "h"
    },
    {
      "inputs": [
        "ni"
      ],
      "output": "?"
    },
    {
      "inputs": [
        "ae"
      ],
      "output": "o"
    },
    {
      "inputs": [
        "au"
      ],
      "output": "-"
    },
    {
      "inputs": [
        "ai"
      ],
      "output": "."
    },
    {
      "inputs": [
        "eu"
      ],
      "output": "\""
    },
    {
      "inputs": [
        "ei"
      ],
      "output": ":"
    },
    {
      "inputs": [
        "ui"
      ],
      "output": ";"
    }
  ]
}
