{
  "layout": {
    "fingers": [
      "z m r l f j y o u '  ",
      " n t h s b c d e i a",
      "  x q w k v p g @ . ,"
    ],
    "thumbs": [
      "space",
      ""
    ]
  },
  "fingermap": [
    "0 1 2 2 3 6 6 7 8 9",
    " 0 1 2 3 3 6 6 7 8 9",
    "  0 1 3 3 3 6 6 7 8 9"
  ],
  "board": {
    "isRowStaggered": true,
    "mirrorLeftRowStagger": false,
    "splitAngle": 0,
    "rowOrColumnStagger": [
      0,
      0.25,
      0.75
    ]
  },
  "layers": null,
  "magic": {
    "magicKeys": null,
    "rules": []
  }
}
