{
  "layout": {
    "fingers": [
      "Y m p g v | j u o y",
      "n c t s d z r i a h",
      " w k f b q l x . /"
    ],
    "thumbs": [
      "space",
      "e"
    ]
  },
  "fingermap": [
    "0 1 2 3 3 6 6 7 8 9",
    " 0 1 2 3 3 6 6 7 8 9",
    "  1 2 3 3 3 6 6 7 8 9"
  ],
  "board": {
    "isRowStaggered": true,
    "mirrorLeftRowStagger": false,
    "splitAngle": 0,
    "rowOrColumnStagger": [
      0,
      0.25,
      0.75
    ]
  },
  "layers": null,
  "magic": {
    "magicKeys": null,
    "rules": [
      {
        "inputs": "aY",
        "output": "ay"
      },
      {
        "inputs": "hY",
        "output": "hy"
      }
    ]
  }
}
