{
  "layout": {
    "fingers": [
      "a b c d e f g h i j"
    ]
  },
  "fingermap": [
    "0 1 2 3 3 6 6 7 8 9"
  ],
  "board": {
    "isRowStaggered": true,
    "rowOrColumnStagger": [
      0
    ],
    "mirrorLeftRowStagger": false,
    "splitAngle": 0
  },
  "magic": {
    "rules": [
      {
        "inputs": "th",
        "output": "wrong"
      },
      {
        "inputs": "th",
        "output": "te"
      }
    ],
    "magicKeys": null
  },
  "layers": null
}
